{
  "schema_version": 1,
  "slug": "gemm_hmma_bf16_sm80",
  "shape_point": "ac4_mixed_gemm_m3072_n2048_k3072",
  "repeat_index": 0,
  "launch_index": 0,
  "kernel_name": "gemm_hmma_bf16_sm80_kernel___0",
  "kernel_signature_sha256": "b6acd0ba50f81c8caefe9b39f1718267abe38de6844d50849b6aca42c64591b7",
  "inst_count": 294912,
  "binary_sha256": "93bd779ba719542965c18d9f73f5aa5a545c6631bbfb87575a9239e0765bab30",
  "nvbit_trace_pb_path": "data/local_labels/timing_cohort/nvbit_launch_traces/ac4_mixed_gemm_m3072_n2048_k3072/dynamic_trace.pb",
  "nvbit_trace_pb_sha256": "0cf023d5baf3cd279371ac749971d1ec9ee81554037098df35f28e1b40a49e67",
  "nvbit_tracer_build_hash": "67083eace7f6257ce5e33a6eb80ae0d3f240bbd667f254cdb67e1b7d20d5ed51"
}
