{
  "schema_version": 1,
  "slug": "gemm_hmma_bf16_sm80",
  "shape_point": "ac4_long_m3584_n2048_k1024",
  "repeat_index": 0,
  "launch_index": 0,
  "kernel_name": "gemm_hmma_bf16_sm80_kernel___0",
  "kernel_signature_sha256": "4fb952260c6f61358686eecfb666fa4efbde1ed05e8688715f9a91075ee7c411",
  "inst_count": 344064,
  "binary_sha256": "9426d432bb8afb182ede845b65d59673a468f072141427798281e96dc9d95fa6",
  "nvbit_trace_pb_path": "data/local_labels/timing_cohort/nvbit_launch_traces/ac4_long_m3584_n2048_k1024/dynamic_trace.pb",
  "nvbit_trace_pb_sha256": "4c3fdfc241b190b5c79f3a3f64d89b4d1a0b5cb5b6ddafa9ac8c07f47f51edf6",
  "nvbit_tracer_build_hash": "67083eace7f6257ce5e33a6eb80ae0d3f240bbd667f254cdb67e1b7d20d5ed51"
}
