{
  "schema_version": 1,
  "slug": "gemm_hmma_bf16_sm80",
  "shape_point": "ac4_long_m4096_n2048_k1024",
  "repeat_index": 0,
  "launch_index": 0,
  "kernel_name": "gemm_hmma_bf16_sm80_kernel___0",
  "kernel_signature_sha256": "0fe6903d560bef7b9bce5787d815ee049fa28d025227a188e554891463abe982",
  "inst_count": 393216,
  "binary_sha256": "9426d432bb8afb182ede845b65d59673a468f072141427798281e96dc9d95fa6",
  "nvbit_trace_pb_path": "data/local_labels/timing_cohort/nvbit_launch_traces/ac4_long_m4096_n2048_k1024/dynamic_trace.pb",
  "nvbit_trace_pb_sha256": "25d99d1e3b052fa4bd1e91333f687904e32799afafc8ce8e1363ce102a96e993",
  "nvbit_tracer_build_hash": "67083eace7f6257ce5e33a6eb80ae0d3f240bbd667f254cdb67e1b7d20d5ed51"
}
