{
  "schema_version": 1,
  "slug": "conv2d_implicit_gemm_bf16_sm80",
  "shape_point": "ac4_mixed_conv_b8_h32_w32_c32_f32_rep3",
  "repeat_index": 0,
  "launch_index": 0,
  "kernel_name": "conv2d_implicit_gemm_bf16_sm80_kernel___0",
  "kernel_signature_sha256": "56677d28d1e7478384f7510729278ebeeb98e9e0e26846097cae911b2e9a7135",
  "inst_count": 49152,
  "binary_sha256": "e2151e3732238acb4dcf030d1b0a191cc587a8b84e3d29224c25caff1d455592",
  "nvbit_trace_pb_path": "data/local_labels/timing_cohort/nvbit_launch_traces/ac4_mixed_conv_b8_h32_w32_c32_f32_rep3/dynamic_trace.pb",
  "nvbit_trace_pb_sha256": "d3a9204864ccc7b6c03a610c11cc499c5bc633db090238a22a20cca2e0a705aa",
  "nvbit_tracer_build_hash": "67083eace7f6257ce5e33a6eb80ae0d3f240bbd667f254cdb67e1b7d20d5ed51"
}
